cipcode,label,cip_level,CIPFamily,CIPDefinition
51.0601,Dental Assisting/Assistant,6,51,"A program that prepares individuals to provide patient care, take dental radiographs (x-ray photographs), prepare patients and equipment for dental procedures, and discharge office administrative functions under the supervision of dentists and dental hygienists.  Includes instruction in medical record-keeping, general office duties, reception and patient intake, scheduling, equipment maintenance and sterilization, basic radiography, pre- and post-operative patient care and instruction, chairside assisting, taking tooth and mouth impressions, and supervised practice."
51.0602,Dental Hygiene/Hygienist,6,51,"A program that prepares individuals to clean teeth and apply preventive materials, provide oral health education and treatment counseling to patients, identify oral pathologies and injuries, and manage dental hygiene practices.  Includes instruction in dental anatomy, microbiology, and pathology; dental hygiene theory and techniques; cleaning equipment operation and maintenance; dental materials; radiology; patient education and counseling; office management; supervised clinical training; and professional standards."
51.0603,Dental Laboratory Technology/Technician,6,51,"A program that prepares individuals, under the supervision of dentists, to design and construct dental prostheses such as caps, crowns, bridges, dentures, splints, and orthodontic appliances.  Includes instruction in dental anatomy, dental materials, ceramics technology, impressions, complete dentures, partial dentures, orthodontics, crowns and bridges, sculpture, bonding and assembly techniques, and equipment operation."
51.0699,"Dental Services and Allied Professions, Other",6,51,Any instructional program in dental services and allied professions not listed above.
51.0701,Health/Health Care Administration/Management,6,51,"A program that prepares individuals to develop, plan, and manage health care operations and services within health care facilities and across health care systems.  Includes instruction in planning, business management, financial management, public relations, human resources management, health care systems operation and management, health care resource allocation and policy making, health law and regulations, and applications to specific types of health care services."
51.0702,Hospital and Health Care Facilities Administration/Management,6,51,"A program that prepares individuals to apply managerial principles to the administration of hospitals, clinics, nursing homes, and other health care facilities.  Includes instruction in facilities planning, building and operations management, business management, financial management and insurance, fund-raising and marketing, public relations, human resources management and labor relations, health care facilities operations, principles of health care delivery, and applicable law and regulations."
51.0703,Health Unit Coordinator/Ward Clerk,6,51,"A program that prepares individuals, under the supervision of nurses or ward supervisors, to perform routine administrative and reception duties in a patient care unit within a hospital or other health care facility.  Includes instruction in receiving and directing visitors, transcribing medical and nursing orders, preparing requisition forms, scheduling patient appointments and procedures, monitoring patients and personnel, and interpersonal skills."
51.0704,Health Unit Manager/Ward Supervisor,6,51,"A program that prepares individuals, under the supervision of nursing or medical service administrators, to supervise and coordinate the operations of one or more patient care units in hospitals or other health care facilities.  Includes instruction in planning and initiating administrative procedures, personnel supervision, interpersonal skills, general and/or specialized health care operations and procedures, and consultation with other medical, nursing, and administrative team members."
51.0705,Medical Office Management/Administration,6,51,"A program that prepares individuals to manage the specialized business functions of a medical or clinical office.  Includes instruction in business office operations, business and financial record-keeping, personnel supervision, medical and health care policy administration, conference planning, scheduling and coordination, public relations, and applicable law and regulations."
51.0706,Health Information/Medical Records Administration/Administrator,6,51,"A program that prepares individuals to plan, design, and manage systems, processes, and facilities used to collect, store, secure, retrieve, analyze, and transmit medical records and other health information used by clinical professionals and health care organizations.  Includes instruction in the principles and basic content of the biomedical and clinical sciences, information technology and applications, data and database management, clinical research methodologies, health information resources and systems, office management, legal requirements, and professional standards."
51.0707,Health Information/Medical Records Technology/Technician,6,51,"A program that prepares individuals, under the supervision of health information administrators and other professionals, to construct medical records and clinical databases, perform manipulations on retrieved data, control the security and quality of records, and supervise data entry and technical maintenance personnel.  Includes instruction in clinical and biomedical science data and information requirements, database management, data coding and validation, information security, quality control, health information content and structure, medical business procedures, and legal requirements."
51.0708,Medical Transcription/Transcriptionist,6,51,"A program that prepares individuals to execute verbatim medical conference minutes, medical reports, and medical orders.  Includes instruction in dictation and simultaneous recording, analysis of notes and visual evidence, medical terminology, data processing applications and skills, formal medical report and correspondence formats, professional standards, and applicable law and regulations."
51.0709,Medical Office Computer Specialist/Assistant,6,51,"A program that prepares individuals to apply computer programming, troubleshooting, and information technology skills to the installation, maintenance, and upgrade of standard, customized, or proprietary medical software and associated hardware.  Includes instruction in computer programming, systems analysis, networking, telecommunications, medical records and informatics software applications, information technology, systems administration, computer security, and applicable regulations and certifications or licenses."
51.0710,Medical Office Assistant/Specialist,6,51,"A program that prepares individuals, under the supervision of office managers and other professionals, to perform routine administrative duties in a medical, clinical, or health care facility/system office environment.  Includes instruction in general office skills, data processing, office equipment operation, principles of medical record-keeping and business regulations, medical/clinical office procedures, and communications skills."
51.0711,Medical/Health Management and Clinical Assistant/Specialist,6,51,"A program that prepares individuals, under the supervision of physicians, nurses, or other health care professionals, to perform medical office or facilities management services and perform one or more clinical allied health specialties.  Includes instruction in health care management; medical office administration; medical law and regulations; training in one or more diagnostic, treatment, therapy, or laboratory specialties at the assistant level or above; and applicable professional standards and ethics."
51.0712,Medical Reception/Receptionist,6,51,"A program that prepares individuals, under the supervision of office managers, nurses, or physicians, to provide customer service, visitor reception, and patient intake and discharge services.  Includes instruction in medical office and health care facility procedures, medical terminology, interpersonal skills, record-keeping, customer service, telephone skills, data entry, interpersonal communications skills, and applicable policies and regulations."
51.0713,Medical Insurance Coding Specialist/Coder,6,51,"A program that prepares individuals to perform specialized data entry, classification, and record-keeping procedures related to medical diagnostic, treatment, billing, and insurance documentation.  Includes instruction in medical records and insurance software applications, basic anatomy and physiology, medical terminology, fundamentals of medical science and treatment procedures, data classification and coding, data entry skills, and regulations relating to Medicare and insurance documentation."
51.0714,Medical Insurance Specialist/Medical Biller,6,51,"A program that prepares individuals to perform and manage the medical and health insurance operations in a medical office, health care facility, health maintenance organization, or insurance provider.  Includes instruction in health and medical insurance processes; health insurance law, policy, and regulations; insurance records and paperwork administration; insurance office administration; health/medical insurance software applications; personnel supervision; business mathematics; billing and collection procedures; medical terminology; and communications skills."
51.0715,Health/Medical Claims Examiner,6,51,"A program that prepares individuals to perform specialized investigatory, analytical, evaluative, and consultative functions related to health/medical insurance operations and their regulation.  Includes instruction in health and medical insurance processes and procedures, health insurance law and regulations, health care industry law, record-keeping, analytic and investigatory techniques, evaluation methods, field operations methods, office procedures, related software applications, oral and written communications skills, interviewing techniques, and professional standards and ethics."
51.0716,Medical Administrative/Executive Assistant and Medical Secretary,6,51,"A program that prepares individuals to perform the duties of special assistants and personal secretaries for practicing physicians and nurses, health care facilities and services administrators, and other health care professionals.  Includes instruction in business and medical communications, medical terminology, principles of health care operations, public relations and interpersonal communications, software applications, record-keeping and filing systems, scheduling and meeting planning, applicable policy and regulations, and professional standards and ethics."
51.0717,Medical Staff Services Technology/Technician,6,51,"A program that prepares individuals to perform credentialing, privileging, personnel management, and accreditation compliance services for hospitals and other health care facilities and organizations.  Includes instruction in medical staff organization and management, medical terminology, credentialing and re-credentialing, health care accreditation and regulatory standards, health care law, meeting and negotiation management, and office information systems management."
51.0718,Long Term Care Administration/Management,6,51,"A program that prepares individuals to apply managerial principles to the administration of nursing homes, assisted living facilities, adult day care, home health services, and other long term care settings and agencies serving the elderly and disabled. Includes instruction in social and clinical aspects of aging, health care delivery systems, nursing home administration, assisted living administration, aging policy and government programs, ethics, business management, financial management, human resource management, marketing, and applicable laws and regulations."
51.0719,Clinical Research Coordinator,6,51,"A program that prepares individuals for careers as clinical research administrators or clinical research coordinators where they work under the supervision of a Principal Investigator to organize, coordinate and administer clinical research trials. Includes instruction in pharmacology, medical terminology, foundations of clinical research, project management, ethics, research design and data management, and legal and regulatory compliance ."
51.0799,"Health and Medical Administrative Services, Other",6,51,Any instructional program in health and medical administrative services not listed above.
51.0801,Medical/Clinical Assistant,6,51,"A program that prepares individuals, under the supervision of physicians, to provide medical office administrative services and perform clinical duties including patient intake and care, routine diagnostic and recording procedures, pre-examination and examination assistance, and the administration of medications and first aid.  Includes instruction in basic anatomy and physiology; medical terminology; medical law and ethics; patient psychology and communications; medical office procedures; and clinical diagnostic, examination, testing, and treatment procedures."
51.0802,Clinical/Medical Laboratory Assistant,6,51,"A program that prepares individuals, under the supervision of physicians or laboratory scientists or technologists, to perform waived testing procedures (Clinical Laboratory Improvement Amendments of 1988), phlebotomy, and other duties in support of laboratory teams.  Includes instruction in clinical procedures, various laboratory tests, laboratory mathematics, computer technology, equipment operation and maintenance, sterilization and safety, communications skills, and interpersonal skills."
51.0803,Occupational Therapist Assistant,6,51,"A program that prepares individuals, under the supervision of occupational therapists, to direct patient participation in skill-enhancing, learning, and motivational tasks; correct or diminish pathologies; and to provide direct health education and promotion services.  Includes instruction in human life span development, occupational therapy principles and practice skills, treatment planning and implementation, record-keeping and documentation, patient education and intervention, activity and program direction, and assistive services management."
51.0805,Pharmacy Technician/Assistant,6,51,"A program that prepares individuals, under the supervision of pharmacists, to prepare medications, provide medications and related assistance to patients, and manage pharmacy clinical and business operations.  Includes instruction in medical and pharmaceutical terminology, principles of pharmacology and pharmaceutics, drug identification, pharmacy laboratory procedures, prescription interpretation, patient communication and education, safety procedures, record-keeping, measurement and testing techniques, pharmacy business operations, prescription preparation, logistics and dispensing operations, and applicable standards and regulations."
51.0806,Physical Therapy Technician/Assistant,6,51,"A program that prepares individuals, under the supervision of a physical therapist, to implement physical therapy treatment care plans, train patients, conduct treatment interventions, use equipment, and observe and record patient progress.  Includes instruction in applied anatomy and physiology, applied kinesiology, principles and procedures of physical therapy, basic neurology and orthopedics, physical therapy modalities, documentation skills, psychosocial aspects of health care, wound and injury care, electrotherapy, working with orthotics and prostheses, and personal and professional ethics."
51.0808,Veterinary/Animal Health Technology/Technician and Veterinary Assistant,6,51,"A program that prepares individuals, under the supervision of veterinarians, laboratory animal specialists, and zoological professionals, to provide patient management, care, and clinical procedures assistance as well as owner communication.  Includes instruction in animal nursing care, animal health and nutrition, animal handling, clinical pathology, radiology, anesthesiology, dental prophylaxis, surgical assisting, clinical laboratory procedures, office administration skills, patient and owner management, and applicable standards and regulations."
51.0809,Anesthesiologist Assistant,6,51,"A program that prepares individuals to assist anesthesiologists and nurse anesthetists in developing and implementing patient anesthesia care plans, including preoperative, surgical theater, recovery room, and postoperative/intensive care procedures.  Includes instruction in patient data collection, catheter insertion, airway management and drug administration, assisting the administration and monitoring of regional and peripheral nerve blockades, support therapy, adjusting anesthetic levels during surgery, interoperative monitoring, postoperative procedures, pain clinics and patient education, and administrative tasks."
51.0810,Emergency Care Attendant (EMT Ambulance),6,51,"A program that prepares individuals to assist licensed EMTs, under the supervision of a physician, to prepare and transport ill or injured patients, and to operate emergency vehicles and equipment such as life support units.  Includes instruction in first aid and emergency medicine field techniques, patient stabilization and care, medical field communications, equipment operation and maintenance, emergency vehicle operation, and applicable standards and regulations."
51.0811,Pathology/Pathologist Assistant,6,51,"A program that prepares individuals, under the supervision of pathologists, to assist in the performance of autopsies, obtaining and preparing surgical specimens, preparing autopsy reports, and interacting with other clinicians, officials, and individuals.  Includes instruction in anatomy; physiology; medical terminology; general, systemic, forensic, and pediatric pathology; autopsy procedures; surgical technique; medical photography; tissue preparation; record keeping and laboratory administration; interpersonal skills; and applicable standards and regulations."
51.0812,Respiratory Therapy Technician/Assistant,6,51,"A program that prepares individuals to administer general respiratory care procedures under the supervision of respiratory therapists in a variety of clinical settings.  Includes instruction in patient data collection and monitoring, airway management, installation of nebulizers and other respiratory assistance devices, application and monitoring of breathing gases, equipment operation and maintenance, safety and sanitation procedures, and applicable regulations."
51.0813,Chiropractic Assistant/Technician,6,51,"A program that prepares individuals, under the supervision of a chiropractor, to provide patient management, examination, and treatment services.  Includes instruction in the principles and procedures of chiropractic, radiographic X-Ray procedures and techniques, X-Ray film analysis and media studies, orthopedic and neurological testing, clinical laboratory procedures, patient management and education, office administrative skills, and applicable law and regulations."
51.0814,Radiologist Assistant,6,51,"A program that prepares individuals, under the supervision of a physician, to perform patient assessment, patient management, selected imaging procedures and to make initial observations of diagnostic images. Includes instruction in radiologic procedures and techniques, cross sectional anatomy, pharmacology, pathophysiology, patient assessment, patient care and management, and radiation biology."
51.0815,Lactation Consultant,6,51,"A program that prepares individuals to provide lactation management services and breastfeeding support to women, and to work as a Lactation Consultant in a variety of clinical settings. Includes instruction in anatomy and physiology of lactation, nutrition, breastfeeding techniques and technologies, common concerns and solutions, management of special situations, breastfeeding instruction, professional and legal concerns, and advocacy."
51.0816,Speech-Language Pathology Assistant,6,51,"A program that prepares individuals, under the supervision of speech-language pathologists, to assist in the provision of speech-language pathology services to individuals of all ages, including screenings and assessments, following treatment plans or protocols, documenting and reporting patient performance, performing checks and maintenance of equipment, and providing support in research projects.  Includes instruction in speech and language development, phonetics, childhood and adult communication disorders, speech and hearing screening, and clinical procedures in speech-language pathology."
51.0899,"Allied Health and Medical Assisting Services, Other",6,51,Any instructional program in allied health and medical assisting services not listed above.
51.0901,Cardiovascular Technology/Technologist,6,51,"A program that prepares individuals to perform invasive, noninvasive, and peripheral examinations of the cardiovascular system at the request of physicians to aid in diagnoses and therapeutic treatments.  Includes instruction in reviewing and recording patient histories and clinical data, patient care, investigative and examination procedures, diagnostic procedures, data analysis and documentation, physician consultation, equipment operation and monitoring, and professional standards and ethics."
51.0902,Electrocardiograph Technology/Technician,6,51,"A program that prepares individuals, under the supervision of physicians and nurses, to administer EKG and ECG diagnostic examinations and report results to the treatment team.  Includes instruction in basic anatomy and physiology, the cardiovascular system, medical terminology, cardiovascular medications and effects, patient care, EKG and ECG administration, equipment operation and maintenance, interpretation of cardiac rhythm, patient record management, and professional standards and ethics."
51.0903,Electroneurodiagnostic/Electroencephalographic Technology/Technologist,6,51,"A program that prepares individuals, under the supervision of a physician, to study and record electrical activity in the brain and nervous system for purposes of patient monitoring and supporting diagnoses.  Includes instruction in patient communication and care; taking and abstracting patient histories; application of recording electrodes; EEG, EP, and PSG equipment operation and procedural techniques; and data recording and documentation."
51.0904,Emergency Medical Technology/Technician (EMT Paramedic),6,51,"A program  that prepares individuals, under the remote supervision of physicians, to recognize, assess, and manage medical emergencies in prehospital settings and to supervise Ambulance personnel.  Includes instruction in basic, intermediate, and advanced EMT procedures; emergency surgical procedures; medical triage; rescue operations; crisis scene management and personnel supervision; equipment operation and maintenance; patient stabilization, monitoring, and care; drug administration; identification and preliminary diagnosis of diseases and injuries; communication and computer operations; basic anatomy, physiology, pathology, and toxicology; and professional standards and regulations."
51.0905,Nuclear Medical Technology/Technologist,6,51,"A program that prepares individuals, under the supervision of physicians, to employ radioactive and stable nuclides in diagnostic evaluations and therapeutic applications while monitoring for patient health and safety.  Includes instruction in nuclear physics, health physics, instrumentation and statistics, biochemistry, immunology, radiopharmacology, radiation biology, clinical nuclear medicine, radionuclide therapy, computer applications, safety regulations, equipment operation, quality control, laboratory procedures, taking patient histories, patient evaluation and monitoring, emergency first aid, administration and record-keeping, and personnel supervision."
51.0906,Perfusion Technology/Perfusionist,6,51,"A program that prepares individuals, under the supervision of physicians and nurses, to operate extracorporeal circulation and autotransfusion equipment during medical procedures and surgeries where the support or temporary replacement of a patient's own respiratory or circulatory system is required.  Includes instruction in equipment selection and operation, physician and medical team consultation, patient condition monitoring, procedural techniques, and principles of respiratory and circulatory physiology."
51.0907,Medical Radiologic Technology/Science - Radiation Therapist,6,51,"A program that prepares individuals to administer prescribed courses of radiation treatment, manage patients undergoing radiation therapy, and maintain pertinent records.  Includes instruction in applied anatomy and physiology, oncologic pathology, radiation biology, radiation oncology procedures and techniques, radiation dosimetry, tumor localization, treatment planning, patient communication and management, data collection, record-keeping, and applicable standards and regulations."
51.0908,Respiratory Care Therapy/Therapist,6,51,"A program that prepares individuals, under the supervision of physicians, to assist in developing respiratory care plans, administer respiratory care procedures, supervise personnel and equipment operation, maintain records, and consult with other health care team members.  Includes instruction in the applied basic biomedical sciences; anatomy, physiology, and pathology of the respiratory system; clinical medicine; therapeutic procedures; clinical expressions; data collection and record-keeping; patient communication; equipment operation and maintenance; personnel supervision; and procedures for special population groups."
