cipcode,label,cip_level,CIPFamily,CIPDefinition
00,All Instructional Programs,A,00,All CIP Codes
01,"Agriculture, Agriculture Operations, and Related Sciences",2,01,"Instructional programs that focus on agriculture and related sciences and that prepare individuals to apply specific knowledge, methods, and techniques to the management and performance of agricultural operations."
03,Natural Resources and Conservation,2,03,Instructional programs that focus on the various natural resources and conservation fields and prepare individuals for related occupations.
04,Architecture and Related Services,2,04,Instructional programs that prepare individuals for professional practice in the various architecture-related fields and focus on the study of related aesthetic and socioeconomic aspects of the built environment.
05,"Area, Ethnic, Cultural, Gender, and Group Studies",2,05,"Instructional programs that focus on the defined areas, regions, and countries of the world; defined minority groups within and across societies; and issues relevant to collective gender and group experience."
09,"Communication, Journalism, and Related Programs",2,09,"Instructional programs that focus on how messages in various media are produced, used, and interpreted within and across different contexts, channels, and cultures, and that prepare individuals to apply communication knowledge and skills professionally."
10,Communications Technologies/Technicians and Support Services,2,10,"Instructional programs that prepare individuals to function as equipment operators, support technicians, and operations managers in the film/video, recording, and graphic communications industries."
11,Computer and Information Sciences and Support Services,2,11,Instructional programs that focus on the computer and information sciences and prepare individuals for various occupations in information technology and computer operations fields.
12,Personal and Culinary Services,2,12,"Instructional programs that prepare individuals to provide professional services related to cosmetology, funeral services, and food preparation and service."
13,Education,2,13,"Instructional programs that focus on the theory and practice of learning and teaching, and related research, administrative and support services."
14,Engineering,2,14,Instructional programs that prepare individuals to apply mathematical and     scientific principles to the solution of practical problems.
15,Engineering Technologies and Engineering-Related Fields,2,15,Instructional programs that prepare individuals to apply basic engineering principles and technical skills in support of engineering and related projects or to prepare for engineering-related fields.
16,"Foreign Languages, Literatures, and Linguistics",2,16,"Instructional programs that focus on foreign languages and literatures, the humanistic and scientific study of linguistics, and the provision of professional interpretation and translation services."
19,Family and Consumer Sciences/Human Sciences,2,19,"Instructional programs that focus on the human interface with the physical, social, emotional, and intellectual environments and the developmental stages and needs of individuals in the interrelated spheres of family, workplace, and community."
22,Legal Professions and Studies,2,22,"Instructional programs that prepare individuals for the legal profession, for related support professions and professional legal research, and focus on the study of legal issues in non-professional programs."
23,English Language and Literature/Letters,2,23,"Instructional programs that focus on the structure and use of the English language and dialects, speech, writing, and various aspects of the literatures and cultures of the English-speaking peoples."
24,"Liberal Arts and Sciences, General Studies and Humanities",2,24,"General instructional programs and independent or individualized studies in the liberal arts subjects, the humanities disciplines and the general curriculum."
25,Library Science,2,25,"Instructional programs that focus on the knowledge and skills required for managing and/or maintaining libraries and related information and record systems,  collections and facilities for research and general use."
26,Biological and Biomedical Sciences,2,26,"Instructional programs that focus on the biological sciences and the non-clinical biomedical sciences, and that prepare individuals for research and professional careers as biologists and biomedical scientists."
27,Mathematics and Statistics,2,27,Instructional programs that focus on the systematic study of logical symbolic language and its applications.
28,"Military Science, Leadership and Operational Art",2,28,"Instructional programs that provide professional education and training of military officers in leadership, military science and operational studies, security policy and strategy, military economics and management, and pre-officer training. These CIP codes are not valid for IPEDS reporting."
29,Military Technologies and Applied Sciences,2,29,"Instructional programs that prepare individuals in specialized and advanced subject matter for the armed services and related national security organizations, including intelligence operations, military applied sciences, and military technologies."
30,Multi/Interdisciplinary Studies,2,30,Instructional programs that derive from two or more distinct programs to provide a cross-cutting focus on a subject concentration that is not subsumed under a single discipline or occupational field.
31,"Parks, Recreation, Leisure, and Fitness Studies",2,31,"Instructional programs that focus on the principles and practices of managing parks and other recreational and fitness facilities; providing recreational, leisure and fitness services; and the study of human fitness."
32,Basic Skills and Developmental/Remedial Education,2,32,Instructional programs that focus on the fundamental knowledge and skills that individuals need to function productively in society. These CIP codes are not valid for IPEDS reporting.
33,Citizenship Activities,2,33,"Instructional programs that prepare individuals for citizenship, and provide instruction in how citizens may engage in civic activities. These CIP codes are not valid for IPEDS reporting."
34,Health-Related Knowledge and Skills,2,34,Instructional program that focus on the promotion of personal and family health. These CIP codes are not valid for IPEDS reporting.
35,Interpersonal and Social Skills,2,35,"Programs that focus on the development of methods and skills for effective interactions with others in a variety of settings (private, social, and business settings). These CIP codes are not valid for IPEDS reporting."
36,Leisure and Recreational Activities,2,36,Programs that focus on the development of an appreciation for and competency in recreational and leisure-related activities. These CIP codes are not valid for IPEDS reporting.
37,Personal Awareness and Self-Improvement,2,37,"Programs that focus on the development of improved self-awareness, avoidance of stressful behavior, and improved decision-making skills. These CIP codes are not valid for IPEDS reporting."
38,Philosophy and Religious Studies,2,38,"Instructional programs that focus on logical inquiry, philosophical analysis, and the academic study of organized systems of belief and religious practices."
39,Theology and Religious Vocations,2,39,Instructional programs that focus on the intramural study of theology and that prepare individuals for the professional practice of religious vocations.
40,Physical Sciences,2,40,"Instructional programs that focus on the scientific study of inanimate objects, processes of matter and energy, and associated phenomena."
41,Science Technologies/Technicians,2,41,Instructional programs that prepare individuals to apply scientific principles and technical skills in support of scientific research and development.
42,Psychology,2,42,"Instructional programs that focus on the scientific study of the behavior of individuals, independently or collectively, and the physical and environmental bases of mental, emotional, and neurological activity."
43,"Homeland Security, Law Enforcement, Firefighting and Related Protective Services",2,43,"""Instructional programs that focus on the principles and procedures for providing homeland security"
44,Public Administration and Social Service Professions,2,44,"Instructional programs that prepare individuals to analyze, manage, and deliver public programs and services."
45,Social Sciences,2,45,"Instructional programs that focus on the systematic study of social systems, social institutions, and social behavior."
46,Construction Trades,2,46,"Instructional programs that prepare individuals to apply technical knowledge and skills in the building, inspecting, and maintaining of structures and related properties."
47,Mechanic and Repair Technologies/Technicians,2,47,"Instructional programs that prepare individuals to apply technical knowledge and skills in the adjustment, maintenance, part replacement, and repair of tools, equipment, and machines."
48,Precision Production,2,48,Instructional programs that prepare individuals to apply technical knowledge and skills to create products using techniques of precision craftsmanship or technical illustration.
49,Transportation and Materials Moving,2,49,Instructional programs that prepare individuals to apply technical knowledge and skills to perform tasks and services that facilitate the movement of people or materials.
50,Visual and Performing Arts,2,50,"Instructional programs that focus on the creation and interpretation of works and performances that use auditory, kinesthetic, and visual phenomena to express ideas and emotions in various forms, subject to aesthetic criteria."
51,Health Professions and Related Programs,2,51,Instructional programs that prepare individuals to practice as licensed professionals and assistants in the health care professions and related clinical sciences and administrative and support services.
52,"Business, Management, Marketing, and Related Support Services",2,52,"Instructional programs that prepare individuals to perform managerial, technical support, and applied research functions related to the operation of commercial and non-profit enterprises and the buying and selling of goods and services."
53,High School/Secondary Diplomas and Certificates,2,53,Instructional programs that define the prescribed requirements for high school/secondary school graduation. These CIP codes are not valid for IPEDS reporting.
54,History,2,54,"Instructional programs that focus on the study and interpretation of past events, institutions, issues, and cultures."
60,Residency Programs,2,60,"Programs that prepare medical doctors (MD), osteopaths (DO), dentists (DDS, DMD), veterinarians (DVM), and podiatrists (DPM) for certification as practitioners of recognized specialties in their respective professions. These programs are approved and accredited by designated professional associations and require from one to five years to complete, depending on the program. Residency programs that also result in an academic degree completion, such as an MS or PhD, should be reported under one of the clinical sciences codes located in Series 26, 51.05, or 51.25, rather than in a residency code located in Series 60. These CIP codes are not valid for IPEDS reporting."
01.00,"Agriculture, General",4,01,Instructional content is defined in code 01.0000.
01.01,Agricultural Business and Management,4,01,Instructional content for this group of programs is defined in codes 01.0101 - 01.0199.
01.02,Agricultural Mechanization,4,01,Instructional content for this group of programs is defined in codes 01.0201 - 01.0299.
01.03,Agricultural Production Operations,4,01,Instructional content for this group of programs is defined in codes 01.0301 - 01.0399.
01.04,Agricultural and Food Products Processing,4,01,Instructional content is defined in code 01.0401.
01.05,Agricultural and Domestic Animal Services,4,01,Instructional content for this group of programs is defined in codes 01.0504 - 01.0599.
01.06,Applied Horticulture and Horticultural Business Services,4,01,Instructional content for this group of programs is defined in codes 01.0601 - 01.0699.
01.07,International Agriculture,4,01,Instructional content is defined in code 01.0701.
01.08,Agricultural Public Services,4,01,Instructional content for this group of programs is defined in codes 01.0801 - 01.0899.
01.09,Animal Sciences,4,01,Instructional content for this group of programs is defined in codes 01.0901 - 01.0999.
01.10,Food Science and Technology,4,01,Instructional content for this group of programs is defined in codes 01.1001 - 01.1099.
01.11,Plant Sciences,4,01,Instructional content for this group of programs is defined in codes 01.1101 - 01.1199.
01.12,Soil Sciences,4,01,Instructional content for this group of programs is defined in codes 01.1201 - 01.1299.
01.99,"Agriculture, Agriculture Operations, and Related Sciences, Other",4,01,Instructional content is defined in code 01.9999.
01.XX,"Agriculture, Agriculture Operations, and Related Sciences (Consolidated 01.00-01.99)",4,01,"Instructional programs that focus on agriculture and related sciences and that prepare individuals to apply specific knowledge, methods, and techniques to the management and performance of agricultural operations."
03.01,Natural Resources Conservation and Research,4,03,Instructional content for this group of programs is defined in codes 03.0101 - 03.0199.
03.02,Natural Resources Management and Policy,4,03,Instructional content for this group of programs is defined in codes 03.0201 - 03.0299.
03.03,Fishing and Fisheries Sciences and Management,4,03,Instructional content is defined in code 03.0301.
03.05,Forestry,4,03,Instructional content for this group of programs is defined in codes 03.0501 - 03.0599.
03.06,Wildlife and Wildlands Science and Management,4,03,Instructional content is defined in code 03.0601.
03.99,"Natural Resources and Conservation, Other",4,03,Instructional content is defined in code 03.9999.
03.XX,Natural Resources and Conservation (Consolidated 03.01-03.99),4,03,Instructional programs that focus on the various natural resources and conservation fields and prepare individuals for related occupations.
04.02,Architecture,4,04,Instructional content is defined in code 04.0201.
04.03,"City/Urban, Community and Regional Planning",4,04,Instructional content is defined in code 04.0301.
04.04,Environmental Design,4,04,Instructional content is defined in code 04.0401.
04.05,Interior Architecture,4,04,Instructional content is defined in code 04.0501.
04.06,Landscape Architecture,4,04,Instructional content is defined in code 04.0601.
04.08,Architectural History and Criticism,4,04,Instructional content is defined in code 04.0801.
04.09,Architectural Sciences and Technology,4,04,Instructional content for this group of programs is defined in codes 04.0901 - 04.0999.
04.10,Real Estate Development,4,04,Instructional content is defined in code 04.1001.
04.99,"Architecture and Related Services, Other",4,04,Instructional content is defined in code 04.9999.
04.XX,Architecture and Related Services (Consolidated 04.02-04.99),4,04,Instructional programs that prepare individuals for professional practice in the various architecture-related fields and focus on the study of related aesthetic and socioeconomic aspects of the built environment.
05.01,Area Studies,4,05,Instructional content for this group of programs is defined in codes 05.0101 - 05.0199.
05.02,"Ethnic, Cultural Minority, Gender, and Group Studies",4,05,Instructional content for this group of programs is defined in codes 05.0200 - 05.0299.
05.XX,"Area, Ethnic, Cultural, Gender, and Group Studies (Consolidated 05.01-05.02)",4,05,"Instructional programs that focus on the defined areas, regions, and countries of the world; defined minority groups within and across societies; and issues relevant to collective gender and group experience."
09.01,Communication and Media Studies,4,09,Instructional content for this group of programs is defined in codes 09.0100 - 09.0199.
09.04,Journalism,4,09,Instructional content for this group of programs is defined in codes 09.0401 - 09.0499.
09.07,"Radio, Television, and Digital Communication",4,09,Instructional content for this group of programs is defined in codes 09.0701 - 09.0799.
09.09,"Public Relations, Advertising, and Applied Communication",4,09,Instructional content for this group of programs is defined in codes 09.0900 - 09.0999.
09.10,Publishing,4,09,Instructional content is defined in code 09.1001.
09.99,"Communication, Journalism, and Related Programs, Other",4,09,Instructional content is defined in code 09.9999.
09.XX,"Communication, Journalism, and Related Programs (Consolidated 09.01-09.99)",4,09,"Instructional programs that focus on how messages in various media are produced, used, and interpreted within and across different contexts, channels, and cultures, and that prepare individuals to apply communication knowledge and skills professionally."
10.01,Communications Technology/Technician,4,10,Instructional content is defined in code 10.0105.
10.02,Audiovisual Communications Technologies/Technicians,4,10,Instructional content for this group of programs is defined in codes 10.0201 - 10.0299.
10.03,Graphic Communications,4,10,Instructional content for this group of programs is defined in codes 10.0301 - 10.0399.
10.99,"Communications Technologies/Technicians and Support Services, Other",4,10,Instructional content is defined in code 10.9999.
10.XX,Communications Technologies/Technicians and Support Services (Consolidated 10.01-10.99),4,10,"Instructional programs that prepare individuals to function as equipment operators, support technicians, and operations managers in the film/video, recording, and graphic communications industries."
11.01,"Computer and Information Sciences, General",4,11,Instructional content for this group of programs is defined in codes 11.0101 - 11.0199.
11.02,Computer Programming,4,11,Instructional content for this group of programs is defined in codes 11.0201 - 11.0299.
11.03,Data Processing,4,11,Instructional content is defined in code 11.0301.
11.04,Information Science/Studies,4,11,Instructional content is defined in code 11.0401.
11.05,Computer Systems Analysis,4,11,Instructional content is defined in code 11.0501.
11.06,Data Entry/Microcomputer Applications,4,11,Instructional content for this group of programs is defined in codes 11.0601 - 11.0699.
11.07,Computer Science,4,11,Instructional content is defined in code 11.0701.
11.08,Computer Software and Media Applications,4,11,Instructional content for this group of programs is defined in codes 11.0801 - 11.0899.
11.09,Computer Systems Networking and Telecommunications,4,11,Instructional content is defined in code 11.0901.
11.10,Computer/Information Technology Administration and Management,4,11,Instructional content for this group of programs is defined in codes 11.1001 - 11.1099.
11.99,"Computer and Information Sciences and Support Services, Other",4,11,Instructional content is defined in code 11.9999.
11.XX,Computer and Information Sciences and Support Services (Consolidated 11.01-11.99),4,11,Instructional programs that focus on the computer and information sciences and prepare individuals for various occupations in information technology and computer operations fields.
12.03,Funeral Service and Mortuary Science,4,12,Instructional content for this group of programs is defined in codes 12.0301 - 12.0399.
12.04,Cosmetology and Related Personal Grooming Services,4,12,Instructional content for this group of programs is defined in codes 12.0401 - 12.0499.
12.05,Culinary Arts and Related Services,4,12,Instructional content for this group of programs is defined in codes 12.0500 - 12.0599.
12.99,"Personal and Culinary Services, Other",4,12,Instructional content is defined in code 12.9999.
12.XX,Personal and Culinary Services (Consolidated 12.03-12.99),4,12,"Instructional programs that prepare individuals to provide professional services related to cosmetology, funeral services, and food preparation and service."
13.01,"Education, General",4,13,Instructional content is defined in code 13.0101.
13.02,"Bilingual, Multilingual, and Multicultural Education",4,13,Instructional content for this group of programs is defined in codes 13.0201 - 13.0299.
13.03,Curriculum and Instruction,4,13,Instructional content is defined in code 13.0301.
13.04,Educational Administration and Supervision,4,13,Instructional content for this group of programs is defined in codes 13.0401 - 13.0499.
13.05,Educational/Instructional Media Design,4,13,Instructional content is defined in code 13.0501.
13.06,"Educational Assessment, Evaluation, and Research",4,13,Instructional content for this group of programs is defined in codes 13.0601 - 13.0699.
13.07,International and Comparative Education,4,13,Instructional content is defined in code 13.0701.
13.09,Social and Philosophical Foundations of Education,4,13,Instructional content is defined in code 13.0901.
13.10,Special Education and Teaching,4,13,Instructional content for this group of programs is defined in codes 13.1001 - 13.1099.
13.11,Student Counseling and Personnel Services,4,13,Instructional content for this group of programs is defined in codes 13.1101 - 13.1199.
13.12,"Teacher Education and Professional Development, Specific Levels and Methods",4,13,Instructional content for this group of programs is defined in codes 13.1201 - 13.1299.
13.13,"Teacher Education and Professional Development, Specific Subject Areas",4,13,Instructional content for this group of programs is defined in codes 13.1301 - 13.1399.
13.14,Teaching English or French as a Second or Foreign Language,4,13,Instructional content for this group of programs is defined in codes 13.1401 - 13.1499.
13.15,Teaching Assistants/Aides,4,13,Instructional content for this group of programs is defined in codes 13.1501 - 13.1599.
13.99,"Education, Other",4,13,Instructional content is defined in code 13.9999.
13.XX,Education (Consolidated 13.01-13.99),4,13,"Instructional programs that focus on the theory and practice of learning and teaching, and related research, administrative and support services."
14.01,"Engineering, General",4,14,Instructional content for this group of programs is defined in codes 14.0101 - 14.0102.
14.02,"Aerospace, Aeronautical and Astronautical Engineering",4,14,Instructional content is defined in code 14.0201.
14.03,Agricultural Engineering,4,14,Instructional content is defined in code 14.0301.
14.04,Architectural Engineering,4,14,Instructional content is defined in code 14.0401.
14.05,Biomedical/Medical Engineering,4,14,Instructional content is defined in code 14.0501.
14.06,Ceramic Sciences and Engineering,4,14,Instructional content is defined in code 14.0601.
14.07,Chemical Engineering,4,14,Instructional content for this group of programs is defined in codes 14.0701 - 14.0799.
14.08,Civil Engineering,4,14,Instructional content for this group of programs is defined in codes 14.0801 - 14.0899.
14.09,Computer Engineering,4,14,Instructional content for this group of programs is defined in codes 14.0901 - 14.0999.
14.10,"Electrical, Electronics and Communications Engineering",4,14,Instructional content for this group of programs is defined in codes 14.1001 - 14.1099.
14.11,Engineering Mechanics,4,14,Instructional content is defined in code 14.1101.
14.12,Engineering Physics,4,14,Instructional content is defined in code 14.1201.
14.13,Engineering Science,4,14,Instructional content is defined in code 14.1301.
14.14,Environmental/Environmental Health Engineering,4,14,Instructional content is defined in code 14.1401.
14.18,Materials Engineering,4,14,Instructional content is defined in code 14.1801.
14.19,Mechanical Engineering,4,14,Instructional content is defined in code 14.1901.
14.20,Metallurgical Engineering,4,14,Instructional content is defined in code 14.2001.
14.21,Mining and Mineral Engineering,4,14,Instructional content is defined in code 14.2101.
14.22,Naval Architecture and Marine Engineering,4,14,Instructional content is defined in code 14.2201.
14.23,Nuclear Engineering,4,14,Instructional content is defined in code 14.2301.
14.24,Ocean Engineering,4,14,Instructional content is defined in code 14.2401.
14.25,Petroleum Engineering,4,14,Instructional content is defined in code 14.2501.
14.27,Systems Engineering,4,14,Instructional content is defined in code 14.2701.
14.28,Textile Sciences and Engineering,4,14,Instructional content is defined in code 14.2801. These CIP codes are not valid for IPEDS reporting.
14.31,Materials Science,4,14,Moved from 14.31 to 40.10
14.32,Polymer/Plastics Engineering,4,14,Instructional content is defined in code 14.3201.
14.33,Construction Engineering,4,14,Instructional content is defined in code 14.3301.
14.34,Forest Engineering,4,14,Instructional content is defined in code 14.3401.
14.35,Industrial Engineering,4,14,Instructional content is defined in code 14.3501.
14.36,Manufacturing Engineering,4,14,Instructional content is defined in code 14.3601.
14.37,Operations Research,4,14,Instructional content is defined in code 14.3701.
14.38,Surveying Engineering,4,14,Instructional content is defined in code 14.3801.
14.39,Geological/Geophysical Engineering,4,14,Instructional content is defined in code 14.3901.
14.40,Paper Science and Engineering,4,14,Instructional content is defined in code 14.4001.
14.41,Electromechanical Engineering,4,14,Instructional content is defined in code 14.4101.
14.42,"Mechatronics, Robotics, and Automation Engineering",4,14,Instructional content is defined in code 14.4201.
14.43,Biochemical Engineering,4,14,Instructional content is defined in code 14.4301.
14.44,Engineering Chemistry,4,14,Instructional content is defined in code 14.4401.
14.45,Biological/Biosystems Engineering,4,14,Instructional content is defined in code 14.4501.
