cipcode,label,cip_level,CIPFamily,CIPDefinition
29.0202,Strategic Intelligence,6,29,"A program that focuses on the management, analysis and use of national-level, theatre-level, and international intelligence and related policy issues.  Includes instruction in intelligence organization and management, strategic uses of intelligence, management of intelligence systems and assets, command and control, joint intelligence operations, electronic and signals intelligence, threat assessment and estimation, intelligence analysis and reporting, counterintelligence, and studies of specific regions and situations."
29.0203,Signal/Geospatial Intelligence,6,29,"A program that focuses on the theory, technology and operational aspects of collecting, processing and exploiting remote-sensed, radar, acoustic and other forms of signals intelligence.  Includes instruction in applied physics, wave propagation and capture, radar systems, acoustics and underwater systems, infrared systems, synthetic aperture systems, collection and processing systems, signal phenomenology, signal analysis and exploitation, and applications to specific intelligence problems."
29.0204,"Command & Control (C3, C4I) Systems and Operations",6,29,"A program that focuses on the theory, technology and operational use of information and decision systems in support of battlefield, theatre, and global strategic operations.  Includes instruction in applied mathematics and statistics, computer systems, real-time analysis and decision systems, surveillance and navigation systems, information and communications technology, information security, situational awareness, system integration, joint operations and applications to specific command problems and services."
29.0205,Information Operations/Joint Information Operations,6,29,"A program that focuses on the strategic and operational use of information relative to the support of military and strategic policy and objectives.  Includes instruction in information technology, decision theory and applications, military operations, command and control technology, network operations, network systems integration, computer network defense, space communications technology, and applications to specific military operational tasks."
29.0206,Information/Psychological Warfare and Military Media Relations,6,29,"A program that focuses on the support of military and strategic operations and policy via the use of information as a tool of statecraft and warfighting.  Includes instruction in information technology and systems, information security, command and control, satellite communications, global information dissemination, communications and media management, intelligence, psychological warfare, strategic planning, security policy and doctrine, and applications to specific operations, services, and scenarios."
29.0207,Cyber/Electronic Operations and Warfare,6,29,"A program that focuses on the technological and operation aspects of information warfare, including cyber attack and cyber defense.  Includes instruction in computer and network security, cryptography, computer forensics, systems security engineering, software applications, threat and vulnerability assessment, wireless networks and satellite communications, tactical and strategic planning, legal and ethical issues, and cyber warfare systems development and acquisition."
29.0299,"Intelligence, Command Control and Information Operations, Other",6,29,"Any instructional program in intelligence, command control and information operations not listed above."
29.0301,Combat Systems Engineering,6,29,"A program that focuses on the application of systems engineering and system architecture to the design and construction of modern combat systems and their integration with each other, with host platforms and with other forces into network-centric warfighting systems.  Includes instruction in systems engineering, computer programming, chemical systems, biological systems, material systems, human factors, combat environments, sensor systems, threat and system risk assessment, conventional and unconventional weapons, combat simulation, reliability and maintenance, testing, engineering project management, strategic planning and applications to aerospace, ground, and naval combat systems."
29.0302,Directed Energy Systems,6,29,"A program that focuses on the study of lasers and other directed energy phenomena and their application to the creation of energy beam weapons systems.  Includes instruction in photonics, electro-optics, microwave phenomena, laser chemistry, spectroscopy, chemical lasers, fibre lasers, imaging and optics, laser propagation and control, laser communication, infrared remote sensing, modeling and simulation, and related technologies."
29.0303,Engineering Acoustics,6,29,"A program that focuses on the application of acoustics and signals processing to undersea and antisubmarine warfare.  Includes instruction in acoustics; electrical engineering; the generation, propagation and reception of underwater sound waves; military applications of underwater sound; and acoustic signal processing."
29.0304,Low-Observables and Stealth Technology,6,29,"A program that focuses on the application of electromagnetic field theory, electro-optics and materials science to the reduction of radar, optical and acoustic signatures of weapons systems.  Includes instruction in computational electromagnetics, electro-optics, acoustics, guided wave theory, radiation capture, antenna applications in layered environments, material characterization, radar cross-section analysis, sonar signature analysis, non-destructive testing, remote sensing, and applications to specific weapons systems and operational environments."
29.0305,Space Systems Operations,6,29,"A program that focuses on the design, development, and operation of missiles, satellites and other space-based systems for military purposes.  Includes instruction in the military applications of space, space technology, aerospace engineering, systems architecture, orbital mechanics, launch and retrieval systems, ground support systems, satellite communications, and space-based sensor systems."
29.0306,Operational Oceanography,6,29,"A program that focuses on the study of physical oceanography as applied to the naval tactical and strategic environment and the support of military operations.  Includes instruction in atmospheric thermodynamics and radiation propagation, air-ocean fluid dynamics, ocean waves, nearshore environments and processes, ocean acoustics, ocean analysis, tactical oceanography, prediction, and related quantitative and experimental methods."
29.0307,Undersea Warfare,6,29,"A program that focuses on the principles, engineering design and military concepts that govern the operational employment of underwater sensors and weapons systems.  Includes instruction in acoustics, electrical, and mechanical engineering; mathematics; meteorology; oceanography; physics; operations analysis; human factors; computer science; and robotics."
29.0399,"Military Applied Sciences, Other",6,29,Any instructional program in military applied sciences not listed above.
29.0401,Aerospace Ground Equipment Technology,6,29,"A program that focuses on the principles, technology, and maintenance of ground-based systems and equipments used to support aviation flight operations and space operations.  Includes instruction in computer science, electronics, basic sciences and quantitative methods, air conditioning and refrigeration, corrosion control, fluid power, hazardous materials, industrial safety, maintenance management, vehicle and equipment operation, and applications to specific ground support systems."
29.0402,Air and Space Operations Technology,6,29,"A program that focuses on the principles, technology and maintenance of systems and equipment used in aerospace operations.  Includes instruction in astronomy and astronautics, solid state theory, air and space operations, electronics, computer science, aviation and space flight safety, life support systems, flight operations management systems, programming, propulsion systems, weaponry, maintenance management and applications to specific systems and operations."
29.0403,Aircraft Armament Systems Technology,6,29,"A program that focuses on the principles, technology and maintenance of aircraft weapons systems and associated peripherals.  Includes instruction in basic science and quantitative methods, computer science, electronics, engineering graphics, fluid power, heavy equipment operation, armament systems, weapon materials and processes, weapon safety, corrosion control, aircraft systems maintenance, and maintenance management."
29.0404,Explosive Ordinance/Bomb Disposal,6,29,"A program that focuses on the identification, containment, analysis and neutralization of explosive devices.  Includes instruction in nuclear science, computer science, ordinance and bomb systems, electronics, computer science, industrial radiography, non-destructive testing, equipment operation, inventory management, investigative techniques, forensics, schematic interpretation, safety procedures, site containment and emergency medicine."
29.0405,"Joint Command/Task Force (C3, C4I) Systems",6,29,"A program that focuses on the principles, technology and operational use of command and control (C3, C4I) systems as applied to joint and combined military operations involving unified commands.  Includes instruction in information technology, communications systems, network systems and architecture, systems engineering, C3 and C4I doctrine and policy, C3 and C4I systems management, intelligence, operational and strategic planning, interagency operations, operational security and deception."
29.0406,Military Information Systems Technology,6,29,"A program that focuses on the principles, design and application of computer and networking technology to the military environment. Includes instruction in planning; program development; graphical user interfaces; rapid prototyping; program construction; data types, operations; control flow; arrays; records; file I/O; database access; event-driven OOP structures; and enabling global-networked communications, including databases, systems analysis and design, decision support systems, and network security."
29.0407,Missile and Space Systems Technology,6,29,"A program that focuses on the principles, technology and maintenance of rocket systems, guided missiles, and space vehicles as well as related systems.  Includes instruction in engineering mechanics, engineering graphics, materials and processes, electronics, propellant and guidance systems, control systems, fluid power, nuclear and conventional weapons systems, hazardous materials, non-destructive inspection and testing, quality assurance, safety procedures and maintenance management."
29.0408,Munitions Systems/Ordinance Technology,6,29,"A program that focuses on the principles, technology and maintenance of ground or sea-based weapons systems, ordinance and munitions.  Includes instruction in basic sciences, electronics, systems technology, fluid power, computer science, conventional weapons systems, nuclear weapons systems, munitions systems, storage and safety, equipment operation, guidance and control systems, hazardous materials, corrosion control, nondestructive testing and quality control, and maintenance management."
29.0409,Radar Communications and Systems Technology,6,29,"A program that focuses on the principles, technology and maintenance of air, sea and ground-based radar systems.  Includes instruction in electronic principles and digital techniques, transistors and solid-state component theory, radar systems; maintenance technology, data processing systems, wiring and circuit schematics, maintenance management, safety procedures, and applications to specific systems and services."
29.0499,"Military Systems and Maintenance Technology, Other",6,29,Any instructional program in military systems and maintenance technology not listed above.
29.9999,"Military Technologies and Applied Sciences, Other",6,29,Any instructional program in military technologies and applied sciences not listed above.
30.0000,"Multi-/Interdisciplinary Studies, General",6,30,A program that derives from two or more distinct programs and that is integrated around a unifying theme or topic that cannot be subsumed under a single discipline or occupational field.
30.0101,Biological and Physical Sciences,6,30,"A program that is either a general synthesis of one or more of the biological and physical sciences, or a specialization which draws from the biological and physical sciences."
30.0501,Peace Studies and Conflict Resolution,6,30,"A program that focuses on the origins, resolution and prevention of international and inter-group conflicts. Includes instruction in peace research methods and related social scientific and psychological knowledge bases."
30.0601,Systems Science and Theory,6,30,"A program with a multidisciplinary approach to the analysis and solution of complex problems, requiring a combined approach using data and models from the natural, social, technological, behavioral and life sciences, and other specialized fields."
30.0801,Mathematics and Computer Science,6,30,A program with a general synthesis of mathematics and computer science or a specialization which draws from mathematics and computer science.
30.1001,Biopsychology,6,30,"A program that focuses on biological and psychological linkages, especially the linkages between biochemical and biophysical activity and the functioning of the central nervous system."
30.1101,Gerontology,6,30,"A program that focuses on the human aging process and aged human populations, using the knowledge and methodologies of the social sciences, psychology and the biological and health sciences."
30.1201,Historic Preservation and Conservation,6,30,"A program that focuses on the architectural design principles and building techniques used in historic structures and environments, and the process of saving and restoring old buildings and districts for contemporary use and enjoyment.  Includes instruction in architectural history; building conservation techniques; real estate, land-use and tax laws and codes; economics and public policy; and public relations."
30.1202,Cultural Resource Management and Policy Analysis,6,30,"A program that focuses on the application of cultural studies, public policy analysis, and management skills to planning, promoting, and implementing programs to preserve and protect cultural heritage sites and artifacts.  Includes instruction in historical preservation and conservation, business management, policy analysis, applied economics, public relations, applied history, historical archaeology, and environmental impact studies."
30.1299,"Historic Preservation and Conservation, Other",6,30,Any instructional program that focuses on architectural design and building techniques for historic and restored structures not listed above.
30.1301,Medieval and Renaissance Studies,6,30,"A program that focuses on the  study of the Medieval and/or Renaissance periods in European and circum-Mediterranean history from the perspective of various disciplines in the humanities and social sciences, including history and archeology, as well as studies of period art and music."
30.1401,Museology/Museum Studies,6,30,"A program that focuses on the attitudes, knowledge, and skills required to develop, prepare, organize, administer, conserve, store and retrieve artifacts, exhibits and entire collections in museums and galleries, and that prepares individuals to assume curatorial, technical and managerial positions in museums.  Includes instruction in institutional management, acquisition, exhibit design, conservation, packing techniques, and public relations."
30.1501,"Science, Technology and Society",6,30,"A program that focuses on the contemporary social and public policy ramifications of science and technology, the interrelationship of science and engineering with the public policy process, and the social and ethical dimensions of scientific and technological enterprises."
30.1601,Accounting and Computer Science,6,30,A program that combines accounting with computer science and/or computer studies.
30.1701,Behavioral Sciences,6,30,"A program with a combined or undifferentiated focus on the social sciences, psychology, and biomedical sciences to study complex problems of human individual and social growth and behavior."
30.1801,Natural Sciences,6,30,A program with a combined or undifferentiated focus on one or more of the physical and biological sciences.
30.1901,Nutrition Sciences,6,30,"A scientific program that focuses on the utilization of food for human growth and metabolism, in both normal and dysfunctional states, from the interdisciplinary perspective of the agricultural, human, biological, and biomedical sciences.  Includes instruction in food science, biochemistry, physiology, dietetics, food and nutrition studies, biotechnology, biophysics, and the clinical sciences."
30.2001,International/Global Studies,6,30,"A program that focuses on global and international issues from the perspective of the social sciences, social services, and related fields."
30.2101,Holocaust and Related Studies,6,30,"A program that focuses on genocide in human history with particular reference to Twentieth Century genocides such as that of the Ottoman Armenians during World War I and the Nazi Holocaust during World War II.  Programs also focus on topics such as survivor studies and counseling, war crimes research and prevention, reconciliation and compensation, ethical and spiritual issues, holocaust art and literature, and legacy and effect in relation to subsequent generations."
30.2201,Ancient Studies/Civilization,6,30,"A program that focuses on Western and Non-Western cultures and related topics in the periods of Pre-history and Antiquity.  Includes such disciplines as ancient languages, archeology, history, art history, geography, population studies, environmental studies, religious studies, and the social sciences."
30.2202,"Classical, Ancient Mediterranean and Near Eastern Studies and Archaeology",6,30,"A program that focuses on the cultures, environment, and history of the ancient Near East, Europe, and the Mediterranean basin from the perspective of the humanities and social sciences, including archaeology."
30.2301,Intercultural/Multicultural and Diversity Studies,6,30,"A program that focuses on the dynamic social relations between and among majority and minority groups and different minority groups, and ways to promote mutual tolerance, inter-group cooperation, and the leadership and management of diverse groups and diversity issues in family, educational, recreational, and work settings.  Includes instruction in ethnic and cultural studies, group psychology, sociology, anthropology, conflict resolution, human services and resources, and applications to various functional environments."
30.2401,Neuroscience,6,30,Moved from 30.2401 to 26.1501
30.2501,Cognitive Science,6,30,"A program that focuses on the study of the mind and the nature of intelligence from the interdisciplinary perspectives of computer science, philosophy, mathematics, psychology, neuroscience, and other disciplines.  Includes instruction in mathematics and logic, cognitive process modeling, dynamic systems, learning theories, brain and cognition, neural networking, programming, and applications to topics such as language acquisition, computer systems, and perception and behavior."
30.2601,Cultural Studies/Critical Theory and Analysis,6,30,"An interdisciplinary program that focuses on the analysis and critique of culture in its varied forms, including values, ideas, belief systems, and expressive acts, and the relationship between cultural forms, everyday life, and structures of power.  Includes instruction in anthropology, communications, history, literary studies, philosophy, political economy, and sociology, as well as recent theories and methodologies such as semiotics, deconstruction, postcolonial studies, gender theory, and ethnography."
30.2701,Human Biology,6,30,"An interdisciplinary program that focuses on understanding the human being from the biological, social science, and humanities perspectives and that addresses contemporary issues related to biology and society, such as global health and disease, environmental policy, bioethics, and biotechnology."
30.2801,Dispute Resolution,6,30,"A program that provides individuals with skills in negotiation, mediation, and arbitration, that can be applied to resolve disputes in a variety of settings, including business, legal, domestic, and labor relations."
30.2901,Maritime Studies,6,30,"A program that focuses on the history, science, policy issues, and literature of the ocean. Includes instruction in maritime history, maritime law, maritime literature, oceanography, maritime security, and maritime politics."
30.3001,Computational Science,6,30,"A program that focuses on the study of scientific computing and its application.  Includes instruction in scientific visualization, multi-scale analysis, grid generation, data analysis, applied mathematics, numerical algorithms, high performance parallel computing, and numerical modeling and simulation with applications in science, engineering and other disciplines in which computation plays an integral role."
30.3101,Human Computer Interaction,6,30,"An interdisciplinary program that focuses on the study of the interaction between people and technology and how that technology impacts society, and combines disciplines within the fields of computing and information science (information systems, software engineering, artificial intelligence and design) and the behavior sciences (cognitive science, cognitive psychology, sociology, organizational psychology, and social psychology).  Includes instruction in information technology, cognitive and behavioral sciences, and systems design."
30.3201,Marine Sciences,6,30,"A program that focuses on the study of biology, chemistry, geology and physics applied to marine, estuarine and coastal environments.  Includes instruction in marine biogeochemistry, atmosphere and ocean dynamics, coastal ecology, coastal ocean processes, microbial ecology, marine ecosystem modeling, and polar microbiology."
30.3301,Sustainability Studies,6,30,"A program that focuses on the concept of sustainability from an interdisciplinary perspective. Includes instruction in sustainable development, environmental policies, ethics, ecology, landscape architecture, city and regional planning, economics, natural resources, sociology, and anthropology."
30.9999,"Multi-/Interdisciplinary Studies, Other",6,30,Any instructional program in multi/interdisciplinary studies not listed above.
31.0101,"Parks, Recreation and Leisure Studies",6,31,"A program that focuses on the principles underlying recreational and leisure activities, and the practices involved in providing indoor and outdoor recreational facilities and services for the general public."
31.0301,"Parks, Recreation and Leisure Facilities Management, General",6,31,"A program that prepares individuals to develop and manage park facilities and other indoor and outdoor recreation and leisure facilities.  Includes instruction in supervising support personnel, health and safety standards, public relations, and basic business and marketing principles."
31.0302,Golf Course Operation and Grounds Management,6,31,"A program that prepares individuals to manage the operation of golf courses. Includes instruction in turf grass science and management, golf course design and construction, grounds equipment and operation, pest control, and grounds management."
31.0399,"Parks, Recreation and Leisure Facilities Management, Other",6,31,"Any instructional program in parks, recreation and leisure facilities management not listed above."
31.0501,"Health and Physical Education/Fitness, General",6,31,"A general program that focuses on activities and principles that promote physical fitness, achieve and maintain athletic prowess, and accomplish related research and service goals.  Includes instruction in human movement studies, motivation studies, rules and practice of specific sports, exercise and fitness principles and techniques, basic athletic injury prevention and treatment, and organizing and leading fitness and sports programs."
31.0504,Sport and Fitness Administration/Management,6,31,"A program that prepares individuals to apply business, coaching and physical education principles to the organization, administration and management of athletic programs and teams, fitness/rehabilitation facilities and health clubs, sport recreation services, and related services.  Includes instruction in program planning and development; business and financial management principles; sales, marketing and recruitment; event promotion, scheduling and management; facilities management; public relations; legal aspects of sports; and applicable health and safety standards."
31.0505,Kinesiology and Exercise Science,6,31,"A scientific program that focuses on the anatomy, physiology, biochemistry, and biophysics of human movement, and applications to exercise and therapeutic rehabilitation.  Includes instruction in biomechanics, motor behavior, motor development and coordination, motor neurophysiology, performance research, rehabilitative therapies, the development of diagnostic and rehabilitative methods and equipment, and related analytical methods and procedures in applied exercise and therapeutic rehabilitation."
