cipcode,label,cip_level,CIPFamily,CIPDefinition
13.0607,Learning Sciences,6,13,"A program that focuses on the multiple aspects of learning in different environments, including specific aspects of the content to be mastered, cognitive aspects of the student, the instructional environment and materials, the preparation and activities of the instructor, socio-cultural and linguistic components, and assessment outcomes. Includes instruction in the social, organizational, and cultural dynamics of learning; learning and cognition; learning strategies; educational psychology; educational testing and measurement; instructional design and technology; and statistical design of educational research."
13.0699,"Educational Assessment, Evaluation, and Research, Other",6,13,"Any instructional program in educational evaluation, research and statistics not listed above."
13.0701,International and Comparative Education,6,13,"A program that focuses on the educational phenomena, practices and institutions within different societies and states in comparative perspective, and the study of international educational issues. Includes instruction in comparative research methods, country- or area-specific studies, crossnational studies of learning and teaching styles, international educational policy and development, and analyses of educational migration patterns and experiences."
13.0901,Social and Philosophical Foundations of Education,6,13,"A program that focuses on the systematic study of education as a social and cultural institution, and the educational process as an object of humanistic inquiry.  Includes instruction in such subjects as the philosophy of education, history of education, educational literature, educational anthropology, sociology of education, economics and politics of education, educational policy studies, and studies of education in relation to specific populations, issues, social phenomena, and types of work."
13.1001,"Special Education and Teaching, General",6,13,"A general program that focuses on the design and provision of teaching and other educational services to children or adults with special learning needs or disabilities, and that may prepare individuals to function as special education teachers.  Includes instruction in diagnosing learning disabilities, developing individual education plans, teaching and supervising special education students, special education counseling, and applicable laws and policies."
13.1003,Education/Teaching of Individuals with Hearing Impairments Including Deafness,6,13,"A program that focuses on the design of educational services for children or adults with hearing impairments including deafness which adversely affect their educational performance, and that may prepare individuals to teach such students.  Includes instruction in identifying students with hearing impairments, including deafness, developing individual education plans, teaching and supervising hearing-impaired students, counseling, and applicable laws and policies."
13.1004,Education/Teaching of the Gifted and Talented,6,13,"A program that focuses on the design of educational services for children or adults exhibiting exceptional intellectual, psychomotor or artistic talent or potential, or who exhibit exceptional maturity or social leadership talents, and that may prepare individuals to teach such students.  Includes instruction in identifying gifted and talented students, developing individual education plans, teaching and supervising gifted and talented students, counseling, and applicable laws and policies."
13.1005,Education/Teaching of Individuals with Emotional Disturbances,6,13,"A program that focuses on the design of educational services for children or adults with emotional conditions which adversely affect their educational performance and that may prepare individuals to teach such students.  Includes instruction in identifying students with emotional disturbances, developing individual education plans, teaching and supervising emotionally disturbed students, counseling, and applicable laws and policies."
13.1006,Education/Teaching of Individuals with Mental Retardation,6,13,"A program that focuses on the design of educational services for children or adults with mental disabilities which adversely affect their educational performance and that may prepare individuals to teach such students.  Includes instruction in identifying students with mental retardation, developing individual education plans, teaching and supervising mentally handicapped students, counseling, and applicable laws and policies."
13.1007,Education/Teaching of Individuals with Multiple Disabilities,6,13,"A program that focuses on the design of educational services for children or adults with multiple disabilities which adversely affect their educational performance and that may prepare individuals to teach such students.  Includes instruction in identifying students with multiple disabilities, developing individual education plans, teaching and supervising students with multiple handicaps, counseling, and applicable laws and policies."
13.1008,Education/Teaching of Individuals with Orthopedic and Other Physical Health Impairments,6,13,"A program that focuses on the design of educational services for children or adults with orthopedic and other health impairments which adversely affect their educational performance and that may prepare individuals to teach such students.  Includes instruction in identifying physically disabled students, developing individual education plans, teaching and supervising students with orthopedic and other health impairments, counseling, and applicable laws and policies."
13.1009,Education/Teaching of Individuals with Vision Impairments Including Blindness,6,13,"A program that focuses on the design of educational services for children or adults with visual disabilities which adversely affect their educational performance and that may prepare individuals to teach such students.  Includes instruction in identifying students with visual impairments, developing individual education plans, teaching and supervising blind or visually handicapped students, counseling, and applicable laws and policies."
13.1011,Education/Teaching of Individuals with Specific Learning Disabilities,6,13,"A program that focuses on the design of educational services for children or adults with specific learning disabilities which adversely affect their educational performance and that may prepare individuals to teach such students.  Includes instruction in identifying students with specific learning disabilities, developing individual education plans, teaching and supervising students with specific learning disabilities, counseling, and applicable laws and policies."
13.1012,Education/Teaching of Individuals with Speech or Language Impairments,6,13,"A program that focuses on the study and design of educational services for children or adults with speech and language impairments which adversely affect their educational performance and that may prepare individuals to teach such students.  Includes instruction in identifying students with speech and language impairments, developing individual education plans, teaching and supervising students with speech disabilities, counseling, and applicable laws and policies."
13.1013,Education/Teaching of Individuals with Autism,6,13,"A program that focuses on the design of educational services for children or adults with autism, and that prepares individuals to teach such students.  Includes instruction in identifying students with autism, developing individual education plans, teaching and supervising autistic students, counseling, and applicable laws and policies."
13.1014,Education/Teaching of Individuals Who are Developmentally Delayed,6,13,"A program that focuses on the design of educational services for children or adults who exhibit slow social, physical, cognitive, or emotional growth patterns related to age, or a combination of such factors that affect learning, and that prepares individuals to teach such students.  Includes instruction in identification of developmental delay patterns, developing individual education plans, teaching and supervising developmentally delayed students, counseling, and applicable laws and policies."
13.1015,Education/Teaching of Individuals in Early Childhood Special Education Programs,6,13,"A program that focuses on the design and provision of teaching and other educational services to infant and pre-school age children with special learning needs or disabilities, and that prepares individuals to teach such students.  Includes instruction in diagnosing learning disabilities, developing individual education plans, teaching and supervising special education students, special education counseling, and applicable laws and policies."
13.1016,Education/Teaching of Individuals with Traumatic Brain Injuries,6,13,"A program that focuses on the design of educational services for children or adults who are surviving and recovering from brain and brain stem injuries affecting their cognitive, perceptive, and motor functions.  Includes instruction in  neurophysiology and neuropathology; speech, other sensory, and motor pathologies; emotional and cognitive disabilities; physical and occupational rehabilitation techniques; developing individual education plans, teaching and supervising brain-injured students, counseling, and applicable laws and policies."
13.1017,Education/Teaching of Individuals in Elementary Special Education Programs,6,13,"A program that focuses on the design and provision of teaching and other educational services to children with special learning needs or disabilities who are in the elementary grades. Includes instruction in diagnosing learning disabilities; developing individual education plans; curriculum development, instructional strategies, and classroom management for elementary special education; and teaching elementary education subject matter."
13.1018,Education/Teaching of Individuals in Junior High/Middle School Special Education Programs,6,13,"A program that focuses on the design and provision of teaching and other educational services to children with special learning needs or disabilities who are in junior high/middle school. Includes instruction in diagnosing learning disabilities; developing individual education plans; curriculum development, instructional strategies, and classroom management for middle school special education; and principles of middle school instruction in specific subjects."
13.1019,Education/Teaching of Individuals in Secondary Special Education Programs,6,13,"A program that focuses on the design and provision of teaching and other educational services to children with special learning needs or disabilities who are in the secondary grades. Includes instruction in diagnosing learning disabilities; developing individual education plans; curriculum development, instructional strategies, and classroom management for secondary grades special education; content, methods, and modifications in specific subject areas; issues in vocational education; and promoting successful transitions to postsecondary settings."
13.1099,"Special Education and Teaching, Other",6,13,Any instructional program in special education not listed above.
13.1101,Counselor Education/School Counseling and Guidance Services,6,13,"A program that prepares individuals to apply the theory and principles of guidance and counseling to the provision of support for the personal, social, educational, and vocational development of students, and the organizing of guidance services within elementary, middle and secondary educational institutions.  Includes instruction in legal and professional requirements, therapeutic counselor intervention, vocational counseling, and related sociological and psychological foundations."
13.1102,College Student Counseling and Personnel Services,6,13,"A program that focuses on the organization and provision of counseling, referral, assistance and administrative services to students in postsecondary educational institutions and adult education facilities, and that may prepare individuals to function as professional counselors in such settings.  Includes instruction in applicable laws and policies, residential counseling and services, vocational counseling and placement services, remedial skills counseling, and therapeutic counselor intervention."
13.1199,"Student Counseling and Personnel Services, Other",6,13,Any instructional program in student counseling and personnel services not listed above.
13.1201,Adult and Continuing Education and Teaching,6,13,"A program that prepares individuals to teach adult students in various settings, including basic and remedial education programs, continuing education programs, and programs designed to develop or upgrade specific employment-related knowledge and skills."
13.1202,Elementary Education and Teaching,6,13,"A program that prepares individuals to teach students in the elementary grades, which may include kindergarten through grade eight, depending on the school system or state regulations.  Includes preparation to teach all elementary education subject matter."
13.1203,Junior High/Intermediate/Middle School Education and Teaching,6,13,"A program that prepares individuals to teach students in the middle, intermediate or junior high grades, which may include grades four through nine by regulation."
13.1205,Secondary Education and Teaching,6,13,"A program that prepares individuals to teach students in the secondary grades, which may include grades seven through twelve, depending on the school system or state regulations.  May include preparation to teach a comprehensive curriculum or specific subject matter."
13.1206,"Teacher Education, Multiple Levels",6,13,"A program that prepares individuals to teach students at more than one educational level, such as a combined program in elementary/secondary, early childhood/elementary, elementary/middle school, or junior high/high school teacher education."
13.1207,Montessori Teacher Education,6,13,A program that prepares individuals to teach students at various grade levels according to the pedagogical principles and methods developed by Maria Montessori and her followers.
13.1208,Waldorf/Steiner Teacher Education,6,13,A program that prepares individuals to teach students at various grade levels according to the pedagogical principles and methods developed by Rudolf Steiner and his followers.
13.1209,Kindergarten/Preschool Education and Teaching,6,13,"A program that prepares individuals to teach students in formal settings prior to beginning regular elementary school, usually ranging in age from three to six years (or grade one), depending on the school system or state regulations.  Includes preparation to teach all relevant subject matter."
13.1210,Early Childhood Education and Teaching,6,13,"A program that prepares individuals to teach students ranging in age from infancy through eight years (grade three), depending on the school system or state regulations.  Includes preparation to teach all relevant subject matter."
13.1299,"Teacher Education and Professional Development, Specific Levels and Methods, Other",6,13,Any instructional program in teacher education and professional development not listed above.
13.1301,Agricultural Teacher Education,6,13,A program that prepares individuals to teach vocational agricultural programs at various educational levels.
13.1302,Art Teacher Education,6,13,A program that prepares individuals to teach art and art appreciation programs at various educational levels.
13.1303,Business Teacher Education,6,13,A program that prepares individuals to teach vocational business programs at various educational levels.
13.1304,Driver and Safety Teacher Education,6,13,A program that prepares individuals to teach driver and safety education programs at various educational levels.
13.1305,English/Language Arts Teacher Education,6,13,"A program that prepares individuals to teach English grammar, composition and literature programs at various educational levels."
13.1306,Foreign Language Teacher  Education,6,13,"A program that prepares individuals to teach foreign languages programs at various educational levels, other than French, German or Spanish."
13.1307,Health Teacher Education,6,13,A program that prepares individuals to teach health education programs at various educational levels.
13.1308,Family and Consumer Sciences/Home Economics Teacher Education,6,13,A program that prepares individuals to teach vocational home economics programs at various educational levels.
13.1309,Technology Teacher Education/Industrial Arts Teacher Education,6,13,A program that prepares individuals to teach technology education/industrial arts programs at various educational levels.
13.1310,Sales and Marketing Operations/Marketing and Distribution   Teacher Education,6,13,A program that prepares individuals to teach vocational sales and marketing operations/marketing and distributive education programs at various educational levels.
13.1311,Mathematics Teacher Education,6,13,A program that prepares individuals to teach mathematics programs at various educational levels.
13.1312,Music Teacher Education,6,13,A program that prepares individuals to teach music and music appreciation programs at various educational levels.
13.1314,Physical Education Teaching and Coaching,6,13,A program that prepares individuals to teach physical education programs and/or to coach sports at various educational levels.
13.1315,Reading Teacher Education,6,13,A program that prepares individuals to diagnose reading difficulties and to teach reading programs at various educational levels.
13.1316,Science Teacher Education/General Science Teacher Education,6,13,"A program that prepares individuals to teach general science programs, or a combination of the biological and physical science subject matter areas, at various educational levels."
13.1317,Social Science Teacher Education,6,13,A program that prepares individuals to teach specific social science subjects and programs at various educational levels.
13.1318,Social Studies Teacher Education,6,13,A program that prepares individuals to teach general social studies programs at various educational levels.
13.1319,Technical Teacher Education,6,13,A program that prepares individuals to teach specific vocational technical education programs at various educational levels.
13.1320,Trade and Industrial Teacher Education,6,13,A program that prepares individuals to teach specific vocational trades and industries programs at various educational levels.
13.1321,Computer Teacher Education,6,13,A program that prepares individuals to teach computer education programs at various educational levels.
13.1322,Biology Teacher Education,6,13,A program that prepares individuals to teach biology programs at various educational levels.
13.1323,Chemistry Teacher Education,6,13,A program that prepares individuals to teach chemistry programs at various educational levels.
13.1324,Drama and Dance Teacher Education,6,13,A program that prepares individuals to teach drama and/or dance programs at various educational levels.
13.1325,French Language Teacher Education,6,13,A program that prepares individuals to teach French language programs at various educational levels.
13.1326,German Language Teacher Education,6,13,A program that prepares individuals to teach German language programs at various educational levels.
13.1327,Health Occupations Teacher Education,6,13,A program that prepares individuals to teach specific vocational health occupations programs at various educational levels.
13.1328,History Teacher Education,6,13,A program that prepares individuals to teach history programs at various educational levels.
13.1329,Physics Teacher Education,6,13,A program that prepares individuals to teach physics programs at various educational levels.
13.1330,Spanish Language Teacher Education,6,13,A program that prepares individuals to teach Spanish language programs at various educational levels.
13.1331,Speech Teacher Education,6,13,A program that prepares individuals to teach speech and language arts programs at various educational levels.
13.1332,Geography Teacher Education,6,13,A program that prepares individuals to teach geography at various grade levels.
13.1333,Latin Teacher Education,6,13,A program that prepares individuals to teach Latin at various grade levels.
13.1334,School Librarian/School Library Media Specialist,6,13,A program that prepares individuals to serve as librarians and media specialists in elementary and secondary schools as well as special instructional centers.
13.1335,Psychology Teacher Education,6,13,A program that prepares individuals to teach general psychology at the secondary school level.
13.1337,Earth Science Teacher Education,6,13,A program that prepares individuals to teach earth science programs at various educational levels.
13.1338,Environmental Education,6,13,"A program that prepares individuals to teach environmental education at various educational levels as a K-12 classroom educator. Includes instruction in foundations of environmental education, instructional methods, and related content knowledge."
13.1399,"Teacher Education and Professional Development, Specific Subject Areas, Other",6,13,"Any instructional program in teacher education, specific academic and vocational programs not listed above."
13.1401,Teaching English as a Second or Foreign Language/ESL Language Instructor,6,13,"A program that focuses on the principles and practice of teaching English to students who are not proficient in English or who do not speak, read or write English, and that may prepare individuals to function as teachers and administrators in such programs."
13.1402,Teaching French as a Second or Foreign Language,6,13,"A program that focuses on the principles and practice of teaching French to students who are not proficient in French or who do not speak, read, or write French, and prepares individuals to serve as teachers and administrators."
13.1499,"Teaching English or French as a Second or Foreign Language, Other",6,13,Any program in teaching English or French as a second or foreign language not listed above.
13.1501,Teacher Assistant/Aide,6,13,"A program that prepares individuals to assist a teacher in regular classroom settings or in providing instruction and supervision to special student populations, such as bilingual/bicultural students, special education students, adult learners, and students learning English.  Includes instruction in techniques of general classroom supervision, maintaining order, assisting with lessons and carrying out related assignments."
13.1502,Adult Literacy Tutor/Instructor,6,13,"A program that prepares individuals to serve as instructors and mentors for adults in basic or functional literacy programs in school, institutional, community, and private settings."
13.1599,"Teaching Assistants/Aides, Other",6,13,Any teaching assistant/aide program not listed above.
13.9999,"Education, Other",6,13,Any instructional program in education not listed above.
14.0101,"Engineering, General",6,14,"A program that generally prepares individuals to apply mathematical and scientific principles to solve a wide variety of practical problems in industry, social organization, public works, and commerce.  Includes instruction in undifferentiated and individualized programs in engineering."
14.0102,Pre-Engineering,6,14,A program that prepares individuals for admission or transfer to a baccalaureate-level program in any of the fields of engineering.
14.0201,"Aerospace, Aeronautical and Astronautical/Space Engineering",6,14,"A program that prepares individuals to apply mathematical and scientific principles to the design, development and operational evaluation of aircraft, missiles, space vehicles, and their systems; applied research on flight and orbital characteristics; and the development of systems and procedures for the launching, guidance, and control of air and space vehicles."
14.0301,Agricultural Engineering,6,14,"A program that prepares individuals to apply mathematical and scientific principles to the design, development and operational evaluation of systems, equipment and facilities for production, processing, storage, handling, distribution and use of food, feed, and fiber. Includes applications to aquaculture, forestry, human and natural resources."
14.0401,Architectural Engineering,6,14,"A program that prepares individuals to apply mathematical and scientific principles to the design, development and operational evaluation of materials, systems, and methods used to construct and equip buildings intended for human habitation or other purposes."
14.0501,Bioengineering and Biomedical Engineering,6,14,"A program that prepares individuals to apply mathematical and scientific principles to the design, development and operational evaluation of biomedical and health systems and products such as integrated biomedical systems, instrumentation, medical information systems, artificial organs and prostheses, and health management and care delivery systems."
14.0601,Ceramic Sciences and Engineering,6,14,"A program that prepares individuals to apply mathematical and scientific principles to the design, development and operational evaluation of inorganic non-metallic materials, such as porcelains, cements, industrial ceramics, ceramic superconductors, abrasive, and related materials and systems."
